<?xml version="1.0" encoding="UTF-8"?>
<nifty xmlns="http://nifty-gui.sourceforge.net/nifty-1.3.xsd" xmlns:xsi="http://www.w3.org/2001/XMLSchema-instance" xsi:schemaLocation="http://nifty-gui.sourceforge.net/nifty-1.3.xsd http://nifty-gui.sourceforge.net/nifty-1.3.xsd">
  <useStyles filename="nifty-default-styles.xml" />
  <useControls filename="nifty-default-controls.xml" />

  <screen id="start" controller="de.lessvoid.nifty.examples.messagebox.MessageBoxStartScreen">
    <layer id="layer" childLayout="vertical">
      <panel width="100%" height="50%" childLayout="center">
        <control id="messagebox" name="nifty-messagebox" messageBoxType="ERROR"
                 message="Hello! This is a message box! Fear it!" buttonCaptions="Yes,No,Maybe,Go away" />
      </panel>
      <panel width="100%" height="50" childLayout="horizontal">
        <panel childLayout="center">
          <control id="setInfo" name="button" label="As Information" align="center" valign="center">
            <interact onClick="changeMessageBoxType(INFO)" />
          </control>
        </panel>
        <panel childLayout="center">
          <control id="setWarn" name="button" label="As Warning" align="center" valign="center">
            <interact onClick="changeMessageBoxType(WARNING)" />
          </control>
        </panel>
        <panel childLayout="center">
          <control id="setError" name="button" label="As Error" align="center" valign="center">
            <interact onClick="changeMessageBoxType(ERROR)" />
          </control>
        </panel>
      </panel>
    </layer>
  </screen>
</nifty>
